{
  "schema_version": "1.0",
  "id": "THESIS-LEGAL-LAST-MILE",
  "title": "The Legal Last Mile: Sanitation Governance and Administrative Law in Brazil, Canada (Ontario), and the Netherlands (working title)",
  "institution": "Not confirmed (doctoral application in progress)",
  "research_status": "planning",
  "version": "0.0.1",
  "authors": [
    "Junior Klaus"
  ],
  "source_ids": [
    "SRC-WLD-CONTEXT",
    "SRC-WLD-PRELIM-PDF"
  ],
  "notes": "The thesis has not been written. Chapter entries below are working labels derived from available material, not an agreed structure. Replace them as the project evolves.",
  "chapters": [
    {
      "id": "CH-PRELIM",
      "title": "Preliminary research: The Legal Last Mile (existing PDF, not yet extracted)",
      "status": "draft_available",
      "research_questions": [],
      "claim_ids": [
        "CLM-TH-001"
      ],
      "experiment_ids": [],
      "source_ids": [
        "SRC-WLD-PRELIM-PDF",
        "SRC-WLD-CONTEXT"
      ]
    },
    {
      "id": "CH-JURIMETRICS",
      "title": "Jurimetric dataset and classification validation (working label)",
      "status": "planned",
      "research_questions": [
        "Is the upstream WATER / NOT_WATER filter reliable enough to support the jurimetric analysis?"
      ],
      "claim_ids": [
        "CLM-IC-001",
        "CLM-IC-002",
        "CLM-IC-003",
        "CLM-IC-004",
        "CLM-IC-005",
        "CLM-DS-001",
        "CLM-DS-002"
      ],
      "experiment_ids": [
        "EXP-002",
        "EXP-003"
      ],
      "source_ids": [
        "SRC-WLD-AUDIT",
        "SRC-WLD-VALIDATION",
        "SRC-WLD-README",
        "SRC-WLD-AANSLUIT"
      ]
    },
    {
      "id": "CH-SLR",
      "title": "Systematic literature review (planned; source material not available)",
      "status": "planned",
      "research_questions": [],
      "claim_ids": [],
      "experiment_ids": [
        "EXP-001"
      ],
      "source_ids": []
    }
  ]
}
